{
  "proofstamp": {
    "format": "proofstamp-receipt",
    "format_version": "1.0"
  },
  "artifact": {
    "filename": "example-session.proofstamp.json",
    "size_bytes": 5586,
    "format": "proofstamp-session",
    "format_version": "1.0"
  },
  "fingerprint": {
    "algorithm": "SHA-256",
    "sha256": "ce53a6f80c04d2e902f70b6bfaf70c331ee29817113103edaba8ebfb12bdeaf1"
  },
  "verification": {
    "verified": true,
    "recalculated_sha256": "ce53a6f80c04d2e902f70b6bfaf70c331ee29817113103edaba8ebfb12bdeaf1",
    "method": "Read the saved artifact bytes twice and compare both SHA-256 calculations."
  },
  "created_at": {
    "value": "2026-08-21T12:05:01Z",
    "provenance": "derived"
  },
  "limitations": [
    "This receipt identifies the exact bytes of the synthetic session artifact. It does not authenticate the AI provider; capture completeness is a separate claim recorded inside the artifact.",
    "The receipt creation time is synthetic and is not external timestamp evidence."
  ]
}
